{
  "id": "before_after",
  "fits": "transformation-style offers (wellness, services, tools)",
  "hook_rules": "Open inside the 'before' at its worst moment — the frustration, not the backstory. The viewer should recognise their own current state in the first 2 seconds.",
  "cta_beat": "result",
  "beats": [
    { "id": "before", "purpose": "the starting state at its most painful and specific", "weight": 1.3, "caption_hint": "the frustration" },
    { "id": "turn", "purpose": "the moment / decision / tool that changes things", "weight": 1.0 },
    { "id": "change", "purpose": "what actually happened during the shift, briefly", "weight": 1.2 },
    { "id": "result", "purpose": "the after state, concrete, plus how to get it", "weight": 1.2, "caption_hint": "the outcome" }
  ]
}
